{
  "aliases": [],
  "catalogVersion": "1.0.0-100000-test",
  "generatedAt": "2026-07-16T00:00:00.000Z",
  "idMappings": [
    {
      "canonicalId": "nonexistent-entity",
      "confidence": "verified",
      "kind": "unity_guid",
      "sourceValue": "xyz789"
    }
  ],
  "releaseId": "test-release",
  "schemaVersion": "1.0.0"
}
